{
  "ticker": "000681",
  "name": "视觉中国",
  "analysis_time": "2026-04-02T19:30:31.351885",
  "last_updated": "2026-04-01T09:34:35.464667",
  "source_module": "analyzer_indicator_engine",
  "indicators": [
    {
      "date": "2026-03-31",
      "price": 20.07,
      "change": -2.57,
      "ma5": 20.406,
      "ma20": 21.8625,
      "ma60": 25.2328,
      "bias_20": -8.199,
      "roc_5": -1.2303
    },
    {
      "date": "2026-03-30",
      "price": 20.6,
      "change": 0.24,
      "ma5": 20.456,
      "ma20": 22.0265,
      "ma60": 25.2673,
      "bias_20": -6.4763,
      "roc_5": 3.4656
    },
    {
      "date": "2026-03-27",
      "price": 20.55,
      "change": 1.93,
      "ma5": 20.318,
      "ma20": 22.234,
      "ma60": 25.2903,
      "bias_20": -7.574,
      "roc_5": -2.1429
    },
    {
      "date": "2026-03-26",
      "price": 20.16,
      "change": -2.37,
      "ma5": 20.408,
      "ma20": 22.5085,
      "ma60": 25.3083,
      "bias_20": -10.4338,
      "roc_5": -7.8611
    },
    {
      "date": "2026-03-25",
      "price": 20.65,
      "change": 1.62,
      "ma5": 20.752,
      "ma20": 22.789,
      "ma60": 25.3355,
      "bias_20": -9.3861,
      "roc_5": -7.6063
    },
    {
      "date": "2026-03-24",
      "price": 20.32,
      "change": 2.06,
      "ma5": 21.092,
      "ma20": 23.0655,
      "ma60": 25.359,
      "bias_20": -11.9031,
      "roc_5": -7.5102
    },
    {
      "date": "2026-03-23",
      "price": 19.91,
      "change": -5.19,
      "ma5": 21.422,
      "ma20": 23.379,
      "ma60": 25.3758,
      "bias_20": -14.8381,
      "roc_5": -11.2745
    },
    {
      "date": "2026-03-20",
      "price": 21.0,
      "change": -4.02,
      "ma5": 21.928,
      "ma20": 23.8605,
      "ma60": 25.4013,
      "bias_20": -11.9884,
      "roc_5": -5.0204
    },
    {
      "date": "2026-03-19",
      "price": 21.88,
      "change": -2.1,
      "ma5": 22.15,
      "ma20": 24.2675,
      "ma60": 25.4007,
      "bias_20": -9.8383,
      "roc_5": -4.0351
    },
    {
      "date": "2026-03-18",
      "price": 22.35,
      "change": 1.73,
      "ma5": 22.334,
      "ma20": 24.637,
      "ma60": 25.4027,
      "bias_20": -9.2828,
      "roc_5": -3.0789
    },
    {
      "date": "2026-03-17",
      "price": 21.97,
      "change": -2.09,
      "ma5": 22.476,
      "ma20": 25.044,
      "ma60": 25.4022,
      "bias_20": -12.2744,
      "roc_5": -7.2213
    },
    {
      "date": "2026-03-16",
      "price": 22.44,
      "change": 1.49,
      "ma5": 22.818,
      "ma20": 25.3315,
      "ma60": 25.4027,
      "bias_20": -11.4146,
      "roc_5": -4.5513
    },
    {
      "date": "2026-03-13",
      "price": 22.11,
      "change": -3.03,
      "ma5": 23.032,
      "ma20": 25.5,
      "ma60": 25.4037,
      "bias_20": -13.2941,
      "roc_5": -5.5128
    },
    {
      "date": "2026-03-12",
      "price": 22.8,
      "change": -1.13,
      "ma5": 23.29,
      "ma20": 25.7065,
      "ma60": 25.4105,
      "bias_20": -11.3065,
      "roc_5": -2.9374
    },
    {
      "date": "2026-03-11",
      "price": 23.06,
      "change": -2.62,
      "ma5": 23.428,
      "ma20": 25.9065,
      "ma60": 25.4107,
      "bias_20": -10.9876,
      "roc_5": -1.03
    },
    {
      "date": "2026-03-10",
      "price": 23.68,
      "change": 0.72,
      "ma5": 23.476,
      "ma20": 26.142,
      "ma60": 25.4013,
      "bias_20": -9.4178,
      "roc_5": 1.4133
    },
    {
      "date": "2026-03-09",
      "price": 23.51,
      "change": 0.47,
      "ma5": 23.41,
      "ma20": 26.2745,
      "ma60": 25.3808,
      "bias_20": -10.5216,
      "roc_5": -5.0101
    },
    {
      "date": "2026-03-06",
      "price": 23.4,
      "change": -0.38,
      "ma5": 23.658,
      "ma20": 26.4165,
      "ma60": 25.3685,
      "bias_20": -11.419,
      "roc_5": -10.1382
    },
    {
      "date": "2026-03-05",
      "price": 23.49,
      "change": 0.82,
      "ma5": 24.186,
      "ma20": 26.589,
      "ma60": 25.3802,
      "bias_20": -11.6552,
      "roc_5": -8.8475
    },
    {
      "date": "2026-03-04",
      "price": 23.3,
      "change": -0.21,
      "ma5": 24.642,
      "ma20": 26.7165,
      "ma60": 25.3883,
      "bias_20": -12.788,
      "roc_5": -11.0008
    },
    {
      "date": "2026-03-03",
      "price": 23.35,
      "change": -5.66,
      "ma5": 25.218,
      "ma20": 26.952,
      "ma60": 25.3917,
      "bias_20": -13.3645,
      "roc_5": -12.185
    },
    {
      "date": "2026-03-02",
      "price": 24.75,
      "change": -4.95,
      "ma5": 25.866,
      "ma20": 27.1315,
      "ma60": 25.395,
      "bias_20": -8.7776,
      "roc_5": -16.2153
    },
    {
      "date": "2026-02-27",
      "price": 26.04,
      "change": 1.05,
      "ma5": 26.824,
      "ma20": 27.289,
      "ma60": 25.3878,
      "bias_20": -4.5769,
      "roc_5": -10.6383
    },
    {
      "date": "2026-02-26",
      "price": 25.77,
      "change": -1.57,
      "ma5": 27.444,
      "ma20": 27.3435,
      "ma60": 25.3758,
      "bias_20": -5.7546,
      "roc_5": -11.9576
    },
    {
      "date": "2026-02-25",
      "price": 26.18,
      "change": -1.54,
      "ma5": 28.144,
      "ma20": 27.399,
      "ma60": 25.3723,
      "bias_20": -4.4491,
      "roc_5": -14.1358
    },
    {
      "date": "2026-02-24",
      "price": 26.59,
      "change": -9.99,
      "ma5": 29.006,
      "ma20": 27.43,
      "ma60": 25.3583,
      "bias_20": -3.0623,
      "roc_5": -4.0765
    },
    {
      "date": "2026-02-13",
      "price": 29.54,
      "change": 1.37,
      "ma5": 29.232,
      "ma20": 27.5225,
      "ma60": 25.2992,
      "bias_20": 7.3304,
      "roc_5": 14.4518
    },
    {
      "date": "2026-02-12",
      "price": 29.14,
      "change": -0.44,
      "ma5": 28.486,
      "ma20": 27.6255,
      "ma60": 25.1985,
      "bias_20": 5.4823,
      "roc_5": 11.0518
    },
    {
      "date": "2026-02-11",
      "price": 29.27,
      "change": -4.0,
      "ma5": 27.906,
      "ma20": 27.924,
      "ma60": 25.1072,
      "bias_20": 4.8202,
      "roc_5": 9.2164
    },
    {
      "date": "2026-02-10",
      "price": 30.49,
      "change": 9.99,
      "ma5": 27.412,
      "ma20": 28.0565,
      "ma60": 24.9778,
      "bias_20": 8.6736,
      "roc_5": 9.7947
    },
    {
      "date": "2026-02-09",
      "price": 27.72,
      "change": 7.4,
      "ma5": 26.868,
      "ma20": 28.106,
      "ma60": 24.8197,
      "bias_20": -1.3734,
      "roc_5": 5.2791
    },
    {
      "date": "2026-02-06",
      "price": 25.81,
      "change": -1.64,
      "ma5": 26.59,
      "ma20": 28.151,
      "ma60": 24.717,
      "bias_20": -8.3159,
      "roc_5": -2.0493
    },
    {
      "date": "2026-02-05",
      "price": 26.24,
      "change": -2.09,
      "ma5": 26.698,
      "ma20": 28.1615,
      "ma60": 24.6447,
      "bias_20": -6.8231,
      "roc_5": -2.2719
    },
    {
      "date": "2026-02-04",
      "price": 26.8,
      "change": -3.49,
      "ma5": 26.82,
      "ma20": 28.0945,
      "ma60": 24.573,
      "bias_20": -4.6077,
      "roc_5": 2.9186
    },
    {
      "date": "2026-02-03",
      "price": 27.77,
      "change": 5.47,
      "ma5": 26.668,
      "ma20": 27.981,
      "ma60": 24.496,
      "bias_20": -0.7541,
      "roc_5": -0.8568
    },
    {
      "date": "2026-02-02",
      "price": 26.33,
      "change": -0.08,
      "ma5": 26.716,
      "ma20": 27.828,
      "ma60": 24.4025,
      "bias_20": -5.3831,
      "roc_5": -2.2643
    },
    {
      "date": "2026-01-30",
      "price": 26.35,
      "change": -1.86,
      "ma5": 26.838,
      "ma20": 27.7425,
      "ma60": 24.3303,
      "bias_20": -5.0194,
      "roc_5": -5.5556
    },
    {
      "date": "2026-01-29",
      "price": 26.85,
      "change": 3.11,
      "ma5": 27.148,
      "ma20": 27.6155,
      "ma60": 24.2573,
      "bias_20": -2.772,
      "roc_5": -1.0321
    },
    {
      "date": "2026-01-28",
      "price": 26.04,
      "change": -7.03,
      "ma5": 27.204,
      "ma20": 27.4135,
      "ma60": 24.1815,
      "bias_20": -5.0103,
      "roc_5": -3.125
    },
    {
      "date": "2026-01-27",
      "price": 28.01,
      "change": 3.97,
      "ma5": 27.372,
      "ma20": 27.196,
      "ma60": 24.1223,
      "bias_20": 2.9931,
      "roc_5": 4.5149
    },
    {
      "date": "2026-01-26",
      "price": 26.94,
      "change": -3.44,
      "ma5": 27.13,
      "ma20": 26.884,
      "ma60": 24.0155,
      "bias_20": 0.2083,
      "roc_5": -5.2743
    },
    {
      "date": "2026-01-23",
      "price": 27.9,
      "change": 2.84,
      "ma5": 27.43,
      "ma20": 26.644,
      "ma60": 23.9023,
      "bias_20": 4.714,
      "roc_5": -11.7089
    },
    {
      "date": "2026-01-22",
      "price": 27.13,
      "change": 0.93,
      "ma5": 28.17,
      "ma20": 26.348,
      "ma60": 23.7808,
      "bias_20": 2.968,
      "roc_5": -22.7286
    },
    {
      "date": "2026-01-21",
      "price": 26.88,
      "change": 0.3,
      "ma5": 29.766,
      "ma20": 26.073,
      "ma60": 23.6697,
      "bias_20": 3.0952,
      "roc_5": -15.7895
    },
    {
      "date": "2026-01-20",
      "price": 26.8,
      "change": -5.77,
      "ma5": 30.774,
      "ma20": 25.8185,
      "ma60": 23.5657,
      "bias_20": 3.8015,
      "roc_5": -14.8666
    },
    {
      "date": "2026-01-19",
      "price": 28.44,
      "change": -10.0,
      "ma5": 31.71,
      "ma20": 25.5815,
      "ma60": 23.4637,
      "bias_20": 11.1741,
      "roc_5": -0.6289
    },
    {
      "date": "2026-01-16",
      "price": 31.6,
      "change": -10.0,
      "ma5": 31.746,
      "ma20": 25.226,
      "ma60": 23.3333,
      "bias_20": 25.2676,
      "roc_5": 21.445
    },
    {
      "date": "2026-01-15",
      "price": 35.11,
      "change": 9.99,
      "ma5": 30.63,
      "ma20": 24.718,
      "ma60": 23.1638,
      "bias_20": 42.0422,
      "roc_5": 41.004
    },
    {
      "date": "2026-01-14",
      "price": 31.92,
      "change": 1.4,
      "ma5": 28.588,
      "ma20": 24.0105,
      "ma60": 22.9512,
      "bias_20": 32.9418,